{
  "schemaVersion": 1,
  "namespace": "system",
  "featureNamespace": "system",
  "features": [
    {
      "bit": 2,
      "name": "tasks",
      "lifecycle": {
        "status": "active",
        "introduced": { "major": 1, "minor": 0 },
        "deprecated": null,
        "removed": null,
        "replacement": null
      }
    },
    {
      "bit": 3,
      "name": "resources",
      "lifecycle": {
        "status": "active",
        "introduced": { "major": 1, "minor": 0 },
        "deprecated": null,
        "removed": null,
        "replacement": null
      }
    },
    {
      "bit": 4,
      "name": "permissions",
      "lifecycle": {
        "status": "active",
        "introduced": { "major": 1, "minor": 0 },
        "deprecated": null,
        "removed": null,
        "replacement": null
      }
    }
  ],
  "types": [],
  "commands": [
    {
      "id": 1,
      "name": "ClipboardReadText",
      "params": [],
      "returns": {
        "type": "common.HandleRef",
        "handleKind": "common.Task",
        "result": true
      },
      "requiresFeatures": [
        "transport.handle_ref",
        "transport.structured_errors",
        "system.tasks",
        "system.permissions"
      ],
      "requiredPermissions": ["system.ClipboardRead"],
      "createsTaskKind": "system.ClipboardReadText",
      "createsResourceKind": null,
      "lifecycle": {
        "status": "active",
        "introduced": { "major": 1, "minor": 0 },
        "deprecated": null,
        "removed": null,
        "replacement": null
      }
    },
    {
      "id": 2,
      "name": "ClipboardWriteText",
      "params": [{ "name": "text", "type": "string", "optional": false }],
      "returns": {
        "type": "common.HandleRef",
        "handleKind": "common.Task",
        "result": true
      },
      "requiresFeatures": [
        "transport.handle_ref",
        "transport.structured_errors",
        "system.tasks",
        "system.permissions"
      ],
      "requiredPermissions": ["system.ClipboardWrite"],
      "createsTaskKind": "system.ClipboardWriteText",
      "createsResourceKind": null,
      "lifecycle": {
        "status": "active",
        "introduced": { "major": 1, "minor": 0 },
        "deprecated": null,
        "removed": null,
        "replacement": null
      }
    },
    {
      "id": 3,
      "name": "CancelTask",
      "params": [
        {
          "name": "task",
          "type": "common.HandleRef",
          "handleKind": "common.Task",
          "optional": false
        }
      ],
      "returns": { "type": "void", "result": true },
      "requiresFeatures": ["transport.handle_ref", "transport.structured_errors", "system.tasks"],
      "requiredPermissions": [],
      "createsTaskKind": null,
      "createsResourceKind": null,
      "lifecycle": {
        "status": "active",
        "introduced": { "major": 1, "minor": 0 },
        "deprecated": null,
        "removed": null,
        "replacement": null
      }
    },
    {
      "id": 4,
      "name": "CloseResource",
      "params": [
        {
          "name": "resource",
          "type": "common.HandleRef",
          "handleKind": "common.NativeResource",
          "optional": false
        }
      ],
      "returns": { "type": "void", "result": true },
      "requiresFeatures": [
        "transport.handle_ref",
        "transport.structured_errors",
        "system.resources"
      ],
      "requiredPermissions": [],
      "createsTaskKind": null,
      "createsResourceKind": null,
      "lifecycle": {
        "status": "active",
        "introduced": { "major": 1, "minor": 0 },
        "deprecated": null,
        "removed": null,
        "replacement": null
      }
    },
    {
      "id": 5,
      "name": "ResetSession",
      "params": [],
      "returns": { "type": "void", "result": true },
      "requiresFeatures": ["transport.structured_errors"],
      "requiredPermissions": [],
      "createsTaskKind": null,
      "createsResourceKind": null,
      "lifecycle": {
        "status": "active",
        "introduced": { "major": 1, "minor": 0 },
        "deprecated": null,
        "removed": null,
        "replacement": null
      }
    }
  ],
  "permissions": [
    {
      "id": 1,
      "name": "ClipboardRead",
      "lifecycle": {
        "status": "active",
        "introduced": { "major": 1, "minor": 0 },
        "deprecated": null,
        "removed": null,
        "replacement": null
      }
    },
    {
      "id": 2,
      "name": "ClipboardWrite",
      "lifecycle": {
        "status": "active",
        "introduced": { "major": 1, "minor": 0 },
        "deprecated": null,
        "removed": null,
        "replacement": null
      }
    }
  ],
  "taskKinds": [
    {
      "id": 1,
      "name": "ClipboardReadText",
      "handleKind": "common.Task",
      "resultType": "string",
      "requiredPermission": "system.ClipboardRead",
      "lifecycle": {
        "status": "active",
        "introduced": { "major": 1, "minor": 0 },
        "deprecated": null,
        "removed": null,
        "replacement": null
      }
    },
    {
      "id": 2,
      "name": "ClipboardWriteText",
      "handleKind": "common.Task",
      "resultType": "void",
      "requiredPermission": "system.ClipboardWrite",
      "lifecycle": {
        "status": "active",
        "introduced": { "major": 1, "minor": 0 },
        "deprecated": null,
        "removed": null,
        "replacement": null
      }
    }
  ],
  "resourceKinds": [
    {
      "id": 1,
      "name": "Window",
      "handleKind": "common.NativeResource",
      "closeCommand": "system.CloseResource",
      "lifecycle": {
        "status": "active",
        "introduced": { "major": 1, "minor": 0 },
        "deprecated": null,
        "removed": null,
        "replacement": null
      }
    },
    {
      "id": 2,
      "name": "File",
      "handleKind": "common.NativeResource",
      "closeCommand": "system.CloseResource",
      "lifecycle": {
        "status": "active",
        "introduced": { "major": 1, "minor": 0 },
        "deprecated": null,
        "removed": null,
        "replacement": null
      }
    },
    {
      "id": 3,
      "name": "FileWatcher",
      "handleKind": "common.NativeResource",
      "closeCommand": "system.CloseResource",
      "lifecycle": {
        "status": "active",
        "introduced": { "major": 1, "minor": 0 },
        "deprecated": null,
        "removed": null,
        "replacement": null
      }
    },
    {
      "id": 4,
      "name": "Process",
      "handleKind": "common.NativeResource",
      "closeCommand": "system.CloseResource",
      "lifecycle": {
        "status": "active",
        "introduced": { "major": 1, "minor": 0 },
        "deprecated": null,
        "removed": null,
        "replacement": null
      }
    },
    {
      "id": 5,
      "name": "HttpRequest",
      "handleKind": "common.NativeResource",
      "closeCommand": "system.CloseResource",
      "lifecycle": {
        "status": "active",
        "introduced": { "major": 1, "minor": 0 },
        "deprecated": null,
        "removed": null,
        "replacement": null
      }
    },
    {
      "id": 6,
      "name": "Socket",
      "handleKind": "common.NativeResource",
      "closeCommand": "system.CloseResource",
      "lifecycle": {
        "status": "active",
        "introduced": { "major": 1, "minor": 0 },
        "deprecated": null,
        "removed": null,
        "replacement": null
      }
    }
  ],
  "ffiFunctions": [
    {
      "abiIndex": 0,
      "library": "system",
      "name": "js_nexa_clipboard_read_text",
      "command": "system.ClipboardReadText",
      "params": [],
      "fixedMappings": [],
      "returns": "string",
      "resultCodec": "legacy_sentinel",
      "status": "legacy",
      "lifecycle": {
        "status": "active",
        "introduced": { "major": 1, "minor": 0 },
        "deprecated": { "major": 1, "minor": 0 },
        "removed": null,
        "replacement": "system.ClipboardReadText"
      }
    },
    {
      "abiIndex": 1,
      "library": "system",
      "name": "js_nexa_clipboard_write_text",
      "command": "system.ClipboardWriteText",
      "params": [{ "name": "text", "type": "string", "mapping": "text.value" }],
      "fixedMappings": [],
      "returns": "i32",
      "resultCodec": "legacy_sentinel",
      "status": "legacy",
      "lifecycle": {
        "status": "active",
        "introduced": { "major": 1, "minor": 0 },
        "deprecated": { "major": 1, "minor": 0 },
        "removed": null,
        "replacement": "system.ClipboardWriteText"
      }
    },
    {
      "abiIndex": 2,
      "library": "system",
      "name": "js_nexa_clipboard_read_text_v1",
      "command": "system.ClipboardReadText",
      "params": [],
      "fixedMappings": [],
      "returns": "string",
      "resultCodec": "nexa_result_json_v1",
      "status": "v1",
      "lifecycle": {
        "status": "active",
        "introduced": { "major": 1, "minor": 0 },
        "deprecated": null,
        "removed": null,
        "replacement": null
      }
    },
    {
      "abiIndex": 3,
      "library": "system",
      "name": "js_nexa_clipboard_write_text_v1",
      "command": "system.ClipboardWriteText",
      "params": [{ "name": "text", "type": "string", "mapping": "text.value" }],
      "fixedMappings": [],
      "returns": "string",
      "resultCodec": "nexa_result_json_v1",
      "status": "v1",
      "lifecycle": {
        "status": "active",
        "introduced": { "major": 1, "minor": 0 },
        "deprecated": null,
        "removed": null,
        "replacement": null
      }
    },
    {
      "abiIndex": 4,
      "library": "system",
      "name": "js_nexa_cancel_task_v1",
      "command": "system.CancelTask",
      "params": [
        { "name": "taskSlot", "type": "u32", "mapping": "task.slot" },
        { "name": "taskGeneration", "type": "u32", "mapping": "task.generation" }
      ],
      "fixedMappings": [],